{
  "$schema": "../../../codegen/api_schema.json",
  "name": "listNames",
  "struct_name": "SecretsListNames",
  "description": "The stored secrets' names and bound origins, sorted by name — never values. Payload { namespace? } (provider | plugin | mcp) filters by namespace; it is read from the whole payload because `namespace` cannot be a generated C++ field. Returns { secrets: [{ name, origin, processEnv }] } (origin empty for a process-only secret).",
  "inputs": [
    {
      "name": "payload",
      "type": "passthrough_payload",
      "required": true,
      "description": "The whole payload: { namespace?: 'provider' | 'plugin' | 'mcp' }."
    }
  ],
  "runtime": {
    "thread": "ui"
  }
}
