{
  "$schema": "../../../codegen/api_schema.json",
  "name": "broadcastSessionsSummary",
  "description": "Re-broadcast the compact session-list summary as a 'nexusSessionsSummary' WebUI listener event for the new session-list UI.",
  "inputs": [
    {
      "name": "payload",
      "type": "passthrough_payload",
      "description": "Opaque sessions-summary snapshot. Re-broadcast verbatim."
    }
  ],
  "runtime": {
    "thread": "ui"
  }
}
