{
  "$schema": "../../../codegen/api_schema.json",
  "name": "call",
  "description": "One-shot non-streaming LLM completion.",
  "inputs": [
    {
      "name": "payload",
      "type": "passthrough_payload",
      "description": "Vercel-aligned LLM call params (model, messages, tools, ...)."
    }
  ],
  "runtime": {
    "thread": "ui"
  }
}
